# USB connection info:
# configuration value: 1
# interface # and alternate setting #: 0
# Endpoint addresses: 129 & 2
# endIN: 0x81
# endOUT: 0x2



DEVICE ID 03eb:6123 on Bus 000 Address 001 =================
 bLength                :   0x12 (18 bytes)
 bDescriptorType        :    0x1 Device
 bcdUSB                 :  0x200 USB 2.0
 bDeviceClass           :    0x0 Specified at interface
 bDeviceSubClass        :    0x0
 bDeviceProtocol        :    0x0
 bMaxPacketSize0        :   0x40 (64 bytes)
 idVendor               : 0x03eb
 idProduct              : 0x6123
 bcdDevice              :   0x54 Device 0.54
 iManufacturer          :    0x1 Atmel
 iProduct               :    0x2 QRG-I/F
 iSerialNumber          :    0x0
 bNumConfigurations     :    0x1
  CONFIGURATION 1: 100 mA ==================================
   bLength              :    0x9 (9 bytes)
   bDescriptorType      :    0x2 Configuration
   wTotalLength         :   0x29 (41 bytes)
   bNumInterfaces       :    0x1
   bConfigurationValue  :    0x1
   iConfiguration       :    0x0
   bmAttributes         :   0x80 Bus Powered
   bMaxPower            :   0x32 (100 mA)
    INTERFACE 0: Human Interface Device ====================
     bLength            :    0x9 (9 bytes)
     bDescriptorType    :    0x4 Interface
     bInterfaceNumber   :    0x0
     bAlternateSetting  :    0x0
     bNumEndpoints      :    0x2
     bInterfaceClass    :    0x3 Human Interface Device
     bInterfaceSubClass :    0x0
     bInterfaceProtocol :    0x0
     iInterface         :    0x0
      ENDPOINT 0x81: Interrupt IN ==========================
       bLength          :    0x7 (7 bytes)
       bDescriptorType  :    0x5 Endpoint
       bEndpointAddress :   0x81 IN                 !!!!!!!!!!!!!!!!!!!
       bmAttributes     :    0x3 Interrupt
       wMaxPacketSize   :   0x40 (64 bytes)
       bInterval        :    0x1
      ENDPOINT 0x2: Interrupt OUT ==========================
       bLength          :    0x7 (7 bytes)
       bDescriptorType  :    0x5 Endpoint
       bEndpointAddress :    0x2 OUT                !!!!!!!!!!!!!!!!!!!
       bmAttributes     :    0x3 Interrupt
       wMaxPacketSize   :   0x40 (64 bytes)
       bInterval        :    0x1
